wiki_name,parkCode,name,lat,lon,description,directionsInfo,directionsUrl,url,monday,tuesday,wednesday,thursday,friday,saturday,sunday
Isle Royale,isro,Rock Harbor Visitor Center,48.145944902483436,-88.4862631559372,"The Rock Harbor Visitor Center is located in Rock Harbor on the northeast end of Isle Royale National Park. It is only accessible by boat or seaplane. Permitting and fee payment, trip planning assistance, and a park store area available.","Rock Harbor is accessible by ferry, private boat, or seaplane. The Ranger III (Houghton, MI), Isle Royale Queen IV (Copper Harbor, MI), and Voyageur II (Grand Portage, MN) boat ferries have service to Rock Harbor. Isle Royale Seaplanes (Houghton, MI and Grand Marais, MN) also has service to Rock Harbor. The Rock Harbor Visitor Center is located at the end of the main passenger ferry dock beneath the breezeway.",https://www.nps.gov/isro/planyourvisit/transportation-services.htm,https://www.nps.gov/isro/planyourvisit/rock-harbor.htm,8:00AM - 5:00PM,8:00AM - 5:00PM,8:00AM - 5:00PM,8:00AM - 5:00PM,8:00AM - 5:00PM,8:00AM - 5:00PM,8:00AM - 5:00PM
Isle Royale,isro,Windigo Visitor Center,47.911804555916106,-89.15714263916016,"The Windigo Visitor Center is located in Windigo on the southwest end of Isle Royale National Park. It is only accessible by boat or seaplane. Permitting and fee payment, trip planning assistance, a park store, and exhibits are available.","Windigo is accessible by ferry, private boat, or seaplane. The Voyageur II (Grand Portage, MN) and Seahunter III (Grand Portage, MN) boat ferries have service to Windigo. Isle Royale Seaplanes (Houghton, MI) also has service to Windigo. The Windigo Visitor Center is located up a hill to the left of the main ferry dock. It is a brown building with a front porch.",https://www.nps.gov/isro/planyourvisit/ferry-transportation-services.htm,https://www.nps.gov/isro/planyourvisit/windigo.htm,8:00AM - 5:00PM,8:00AM - 5:00PM,8:00AM - 5:00PM,8:00AM - 5:00PM,8:00AM - 5:00PM,8:00AM - 5:00PM,8:00AM - 5:00PM
Joshua Tree,jotr,Black Rock Nature Center,34.0733588625,-116.39063817,"Located in the heart of the beautiful Black Rock Campground, the Nature Center offers a bookstore, art gallery, visitor resources, and a picnic area. Visitors can chat with a park ranger, shop at the bookstore, and observe exhibits in the art gallery. There is also a water-bottle filling station and a restroom with flush toilets. The Nature Center is open from 8:00-11:00am 12:00-4:00pm. It is closed from 11:00am - 12:00pm. Hours may vary depending on staff availability, especially in the summer.","From CA Hwy 62 (the Twentynine Palms Hwy), turn south onto Joshua Lane or Avalon Avenue. Continue for about 5 miles, following signs to Black Rock.",,http://www.nps.gov/jotr/planyourvisit/visitorcenters.htm,8:00AM - 4:00PM,8:00AM - 4:00PM,8:00AM - 4:00PM,8:00AM - 4:00PM,8:00AM - 4:00PM,8:00AM - 4:00PM,8:00AM - 4:00PM
Joshua Tree,jotr,Cottonwood Visitor Center,33.7485107554,-115.824081943,"Located on Pinto Basin Road, approximately 7 miles north of Interstate 10 (exit 168), the Cottonwood Visitor Center is a convenient stop for those entering and exiting the park from the south. It has educational exhibits, a bookstore, visitor resources, and restroom facilities. You can grab a park map, buy an entrance pass, fill up your water bottle, and chat with a park ranger to get all your questions answered. The flush toilets are currently out of service.","From I-10, take exit 168 for the Cottonwood Springs Rd. Enter Joshua Tree National Park at the South Entrance. Continue Cottonwood Springs Rd. for about 6 miles. Cottonwood Visitor Center will be on your right.",,http://www.nps.gov/jotr/planyourvisit/visitorcenters.htm,8:30AM - 4:00PM,8:30AM - 4:00PM,8:30AM - 4:00PM,8:30AM - 4:00PM,8:30AM - 4:00PM,8:30AM - 4:00PM,8:30AM - 4:00PM
Joshua Tree,jotr,Joshua Tree National Park Visitor Center,34.13488358033109,-116.05708122253418,"The Joshua Tree National Park Visitor Center is located in downtown Twentynine Palms and features educational exhibits, a bookstore and giftshop, and visitor information.","Heading east on Hwy 62 into the town of Twentynine Palms: Turn right onto Freedom Way, which may show up on your map as Yucca Ave. If you reach National Park Drive, you have gone too far. Heading west on Hwy 62 into the town of Twentynine Palms: Turn left onto Freedom Way (aka Yucca Ave). If you reach Tamarisk Ave you have gone too far. The Joshua Tree National Park Visitor Center is located next to Freedom Plaza, less than a block off of Hwy 62",,,8:00AM - 5:00PM,8:00AM - 5:00PM,8:00AM - 5:00PM,8:00AM - 5:00PM,8:00AM - 5:00PM,8:00AM - 5:00PM,8:00AM - 5:00PM
Joshua Tree,jotr,Joshua Tree Visitor Center,34.13387197423593,-116.31545986179077,"Located in downtown Joshua Tree just five miles from the West Entrance, the Joshua Tree Visitor Center offers educational exhibits, a bookstore, and visitor resources. Grab a park map, buy an entrance pass, and chat with a park ranger to get all your questions answered before heading into the park! The parking lot at the visitor center has 2 standard accessible spaces and 40 other spaces. The restrooms have grab bars available in all larger stalls intended for wheelchair users and running water.","From CA Hwy 62 (the Twentynine Palms Highway) in downtown Joshua Tree, turn south onto Park Blvd. The Joshua Tree Visitor Center will be on your right.",,http://www.nps.gov/jotr/planyourvisit/visitorcenters.htm,7:30AM - 5:00PM,7:30AM - 5:00PM,7:30AM - 5:00PM,7:30AM - 5:00PM,7:30AM - 5:00PM,7:30AM - 5:00PM,7:30AM - 5:00PM
Katmai,katm,Brooks Camp Visitor Center,58.5561368671,-155.778221157,"The Brooks Camp Visitor Center, open June 1 – September 29, is the point of entry for all visitors to Brooks Camp. A park ranger is on duty to provide information, campground check-in, mandatory bear etiquette and safety talks, and backcountry planning. An Alaska Geographic Association (AGA) bookstore offers books, maps, and other Katmai-related items.","Brooks Camp is located on the northern Alaska Peninsula, about 30 miles east of King Salmon and about 290 air miles southwest of Anchorage. Unlike most national park visitor centers in the United States, Brooks Camp's visitor center is only accessible by plane or boat.",http://www.nps.gov/katm/planyourvisit/directions.htm,https://www.nps.gov/katm/planyourvisit/visitorcenters.htm,Closed,Closed,Closed,Closed,Closed,Closed,Closed
Katmai,katm,King Salmon Visitor Center,58.6828321301,-156.668507335,"Located next door to the King Salmon Airport, the King Salmon Visitor Center provides information on the many federal public lands of Southwest Alaska, particularly those in the Bristol Bay area. A large collection of films is available for viewing and an Alaska Geographic bookstore sells maps, charts, videos, posters, clothing and more.",This visitor center is located next to the passenger terminal at the King Salmon Airport.,http://www.nps.gov/katm/contacts.htm,https://www.nps.gov/katm/planyourvisit/visitorcenters.htm,Closed,Closed,Closed,Closed,Closed,Closed,Closed
Katmai,katm,Robert F. Griggs Visitor Center,58.36864,-155.382878,The Robert F. Griggs Visitor Center overlooks the famous Valley of Ten Thousand Smokes and is the starting point of the Ukak Falls Trail. The posted hours are estimated because the visitor center is only open during ranger-led Valley of Ten Thousand Smokes tours.,Located 23 miles from Brooks Camp on the only road within Katmai National Park & Preserve. Visitors can participate in a Ranger-led Valley of Ten Thousand Smokes Tour where this center is a lunch stop before hiking to the valley floor.,https://www.nps.gov/katm/planyourvisit/rangerguided.htm,https://www.nps.gov/katm/planyourvisit/visitorcenters.htm,Closed,Closed,Closed,Closed,Closed,Closed,Closed
Kenai Fjords,kefj,Exit Glacier Nature Center,60.18832584166407,-149.6316518248616,"The Exit Glacier Nature Center is the trailhead for all that the Exit Glacier area has to offer, including the Harding Icefield trail. The building includes exhibits about the Exit Glacier area, an Alaska Geographic bookstore, and park rangers to help answer questions about the area.","Turn on to Herman Leirer Road (commonly called ""Exit Glacier Road"") at mile 3 of the Seward Highway - AK-9. Proceed 8.4 miles. The road will end at the parking lot for the nature center. Google Map Coordinates: 60.1782633,-149.6494389",http://www.nps.gov/kefj/planyourvisit/directions.htm,https://www.nps.gov/kefj/planyourvisit/visitorcenters.htm#naturecenter,9:30AM - 5:00PM,9:30AM - 5:00PM,9:30AM - 5:00PM,9:30AM - 5:00PM,9:30AM - 5:00PM,9:30AM - 5:00PM,9:30AM - 5:00PM
Kenai Fjords,kefj,Kenai Fjords National Park Visitor Center,60.11627448593049,-149.43974342276806,"The main park visitor center is located in the Seward small boat harbor. The visitor center provides opportunities to view the park film, an Alaska Geographic bookstore, and park rangers to help answer questions about the area.","Once within the city limits of the town of Seward, turn left on S. Harbor Street (mile 1 of the Seward Highway - AK-9). Go one block, and turn right on Fourth Street. It will be the second building on the left. Google Map Coordinates: 60.1165108,-149.4405508",http://www.nps.gov/kefj/planyourvisit/directions.htm,http://www.nps.gov/kefj/planyourvisit/visitorcenters.htm,9:00AM - 5:30PM,9:00AM - 5:30PM,9:00AM - 5:30PM,9:00AM - 5:30PM,9:00AM - 5:30PM,9:00AM - 5:30PM,9:00AM - 5:30PM
Kings Canyon,seki,Cedar Grove Visitor Center,36.7909601761,-118.671134612,"This visitor center is next to the South Fork of the Kings River in mixed conifer forest at an elevation of 4,600 feet (1,400 m). Learn about the natural and cultural history of the Cedar Grove area. Nearby services include accessible restrooms and a pay phone.","On Highway 180, 30 miles (48 km) east of Grant Grove. Next to Sentinel Campground.",http://www.nps.gov/seki/planyourvisit/visitorcenters.htm,http://www.nps.gov/seki/planyourvisit/visitorcenters.htm,9:00AM - 5:00PM,9:00AM - 5:00PM,9:00AM - 5:00PM,9:00AM - 5:00PM,9:00AM - 5:00PM,9:00AM - 5:00PM,9:00AM - 5:00PM
Kings Canyon,seki,Foothills Visitor Center,36.4910724123,-118.825590743,"This visitor center is one mile past the Ash Mountain entrance station along the Generals Highway. Stop here for information, maps, books, gifts, and restrooms. Browse exhibits about the ecology and human history of the foothills, and join a free ranger-led program.",On the Generals Highway 1 mile (1.6 km) north of the Ash Mountain Entrance.,http://www.nps.gov/seki/planyourvisit/visitorcenters.htm,http://www.nps.gov/seki/planyourvisit/visitorcenters.htm,8:00AM - 5:00PM,8:00AM - 5:00PM,8:00AM - 5:00PM,8:00AM - 5:00PM,8:00AM - 5:00PM,8:00AM - 5:00PM,8:00AM - 5:00PM
Kings Canyon,seki,Giant Forest Museum,36.56468778866104,-118.7726831068016,"The museum is housed in a historic market in the Giant Forest sequoia grove at 6,500 feet (1,980 m) elevation. Explore exhibits about sequoias and learn why this landscape grows the biggest of big trees. Stop here before you explore the grove. Giant Forest Museum is open year-round except when weather or safety conditions require a closure. Hours vary seasonally. During wilderness permit non-quota season, permits can be picked up at a self-issue station outside the museum.",On the Generals Highway 16 miles (26 km) north of the Ash Mountain Entrance.,http://www.nps.gov/seki/planyourvisit/visitorcenters.htm,http://www.nps.gov/seki/planyourvisit/visitorcenters.htm,9:00AM - 6:00PM,9:00AM - 6:00PM,9:00AM - 6:00PM,9:00AM - 6:00PM,9:00AM - 6:00PM,9:00AM - 6:00PM,9:00AM - 6:00PM
Kings Canyon,seki,Kings Canyon Visitor Center,36.7400152929,-118.963419957,"This visitor center is in Grant Grove Village at an elevation of 6,500 feet (1,980 m). Learn about three regions in Kings Canyon National Park: giant sequoia groves, Kings Canyon, and the High Sierra. Watch a 15-minute movie (English/Spanish). A park store sells books, maps, and educational materials.","On Highway 180 in Grant Grove Village, 3 miles (5 km) east of the Big Stump Entrance.",http://www.nps.gov/seki/planyourvisit/visitorcenters.htm,http://www.nps.gov/seki/planyourvisit/visitorcenters.htm,8:00AM - 5:00PM,8:00AM - 5:00PM,8:00AM - 5:00PM,8:00AM - 5:00PM,8:00AM - 5:00PM,8:00AM - 5:00PM,8:00AM - 5:00PM
Kings Canyon,seki,Lodgepole Visitor Center,36.604134478,-118.73194481,"Located in the conifer zone at an elevation of 6,700 feet (2,040 m), the visitor center provides opportunities to view exhibits, get trip planning advice, get a wilderness permit, watch several park films, or shop at the gift shop. New exhibits immerse visitors in the wilderness environments of the parks, from the foothills to the highest peaks and to underground caves, as well as exploring the human history of the southern Sierra Nevada with tactile exhibits and soundscapes from every park environment.",On the Generals Highway 21 miles (34 km) north of the Ash Mountain Entrance. 2 miles (3 km) north of the General Sherman Tree.,http://www.nps.gov/seki/planyourvisit/visitorcenters.htm,http://www.nps.gov/seki/planyourvisit/visitorcenters.htm,8:00AM - 5:00PM,8:00AM - 5:00PM,8:00AM - 5:00PM,8:00AM - 5:00PM,8:00AM - 5:00PM,8:00AM - 5:00PM,8:00AM - 5:00PM
Kings Canyon,seki,Mineral King Ranger Station,36.45274261,-118.610793099,"Located in a mixed-conifer forest at 7,600 feet (2,320 m), the Mineral King Ranger Station houses some exhibits on Mineral King's human and natural history. Books, maps, and educational items for sale. Food storage canisters are available. Obtain wilderness permits here. Planning to park overnight? Marmots may attempt to get in your car's undercarriage or damage wiring. Make sure that you wrap the underside of your vehicle in a tarp.",On the Mineral King Road 24 miles (39 km) from the junction of Highway 198 in Three Rivers.,http://www.nps.gov/seki/planyourvisit/visitorcenters.htm,http://www.nps.gov/seki/planyourvisit/visitorcenters.htm,7:30AM - 4:00PM,7:30AM - 4:00PM,7:30AM - 4:00PM,7:30AM - 4:00PM,7:30AM - 4:00PM,7:30AM - 4:00PM,7:30AM - 4:00PM
Kobuk Valley,kova,Northwest Arctic Heritage Center,66.892539,-162.605111,"Large, half-dome shaped, blue and grey building with just over 11,000 square feet of space. The museum space is just over 1,800 square feet and contains animal displays, soundscapes, tactile exhibits and more. The Heritage Center also contains a bookstore, restroom, art gallery, and sitting area. The Northwest Arctic Heritage Center serves as the visitor centers for the Western Arctic National Parklands: Kobuk Valley National Park, Cape Krusenstern National Monument, and Noatak National Preserve.","Visitors generally access the park via the regional hub in Kotzebue. Commercial airlines provide daily service from Fairbanks or Anchorage, to Kotzebue. Chartered flights with licensed air taxi services, booked in advance, can take backcountry travelers to remote destinations within the park.",http://www.nps.gov/kova/planyourvisit/directions.htm,http://www.nps.gov/kova/planyourvisit/northwest-arctic-heritage-center.htm,9:00AM - 5:00PM,9:00AM - 5:00PM,9:00AM - 5:00PM,9:00AM - 5:00PM,9:00AM - 5:00PM,Closed,Closed
Lake Clark,lacl,Port Alsworth Visitor Center,60.1973725818,-154.322665453,Come and enjoy the visitor center and exhibits and get information from our rangers. Visitors can find a wealth of park information including local hiking trail details and check out a bear resistant container at the Port Alsworth Visitor Center. The Bristol Bay Double-Ender “boat barn” will be open daily. Visitors are free to explore the other outdoor exhibits including the Wassilie Trefon Dena’ina Fish Cache and Denison Sawmill Exhibit anytime.,"The visitor center is located midway up the easternmost runway in Port Alsworth, AK.",https://www.nps.gov/lacl/planyourvisit/directions.htm,https://www.nps.gov/lacl/planyourvisit/port-alsworth.htm,10:00AM - 4:30PM,10:00AM - 4:30PM,10:00AM - 4:30PM,10:00AM - 4:30PM,10:00AM - 4:30PM,10:00AM - 4:30PM,10:00AM - 4:30PM
Lassen Volcanic,lavo,Kohm Yah-mah-nee Visitor Center,40.4377782526,-121.533838401,"This year-round visitor center is located one mile from the Southwest Entrance. The visitor center offers an information desk, exhibit hall, auditorium, amphitheater (summer), park store, dining area, patio (summer), and a gift shop and cafe (summer). Free Wi-Fi is available inside.",From Red Bluff: Follow Hwy 36 East for 51 miles to the junction of Hwy 89. Follow Hwy 89 north 6 miles to the southwest entrance station and the Kohm Yah-mah-nee Visitor Center.,https://www.nps.gov/lavo/planyourvisit/directions.htm,http://www.nps.gov/lavo/planyourvisit/visitorcenters.htm,9:30AM - 4:30PM,Closed,Closed,9:30AM - 4:30PM,9:30AM - 4:30PM,9:30AM - 4:30PM,9:30AM - 4:30PM
Lassen Volcanic,lavo,Loomis Museum,40.5361249158,-121.563149108,"The historic museum is located one mile from the northwest entrance of the park near Manzanita Lake. The museum is only open during the summer months. Visit for information, to view exhibits and the park film, participate in a ranger-led program. From the museum you can pick up the trail around Manzanita Lake or cross the highway to access the self-guided, interpretive Lily Pond Nature Trail. Lassen Association store is across the plaza from the Museum.","From Redding, California follow Highway 44 east 50 miles. Turn south on Highway 89 and continue one mile to the park's northwest entrance. From Reno, Nevada follow Highway 395 north to Highway 44. Follow Highway 44 miles west 180 miles. Turn south on Highway 89 and continue one mile to the park's northwest entrance.",https://www.nps.gov/lavo/planyourvisit/directions.htm,https://www.nps.gov/places/loomis-museum.htm,9:30AM - 4:30PM,9:30AM - 4:30PM,Closed,Closed,9:30AM - 4:30PM,9:30AM - 4:30PM,9:30AM - 4:30PM
Mammoth Cave,maca,Mammoth Cave Visitor Center,37.18702160097143,-86.10107059957153,"The park visitor center is the central point for visitors to orient themselves to what lies both above and below the surface at Mammoth Cave. Situated just up the hill from the cave's Historic Entrance, the visitor center is the departure point for all cave tours, and offers exhibits to prepare you for discovery. You can also meet a ranger for a talk or a hike. Gifts, restrooms, permits and information are available and visitor amenities are offered by the nearby Lodge at Mammoth Cave across the footbridge.",From the North: Take Interstate 65 to Exit 53 (Cave City Exit). Turn right onto KY-70. Follow 70/255 as it becomes the Mammoth Cave Parkway in the park. Follow the Mammoth Cave Parkway to the Visitor Center. From the South: Take Interstate 65 to Exit 48 (Park City Exit). Turn left onto KY-255 and follow 255 as it becomes the Park City Road into the park. Follow Park City Road until it joins the Mammoth Cave Parkway; turn left. Follow the Mammoth Cave Parkway to the Visitor Center.,http:///maca/planyourvisit/directions.htm,https://www.nps.gov/maca/planyourvisit/mammoth-cave-visitor-center.htm,8:30AM - 4:30PM,8:30AM - 4:30PM,8:30AM - 4:30PM,8:30AM - 4:30PM,8:30AM - 4:30PM,8:30AM - 4:30PM,8:30AM - 4:30PM
Mesa Verde,meve,Entrance Station Kiosk,37.3316458662,-108.415798078,"The entrance station kiosk is located approximately 1/2 from the entrance to the park and the visitor center. Our friendly rangers can provide you with a park map, information, Jr. Ranger Books and Badges and a passport stamp as well as collecting the entrance fee. Visitors arriving outside station hours may pay their fee directly through www.recreation.gov. Park brochures can be found at the signboard on the right.",,,,All Day,All Day,All Day,All Day,All Day,All Day,All Day
Mesa Verde,meve,Mesa Verde Museum,37.18453,-108.488294,"Located at milepost 20, the Mesa Verde Mesa Museum offers exhibits and cultural objects that provide insight into the Ancestral Pueblo lifeways. An orientation film is shown on the hour and half-hour, providing an excellent overview of the history at Mesa Verde. A museum store, water, restrooms, café, gift shop, and post office are all located nearby. Just behind the museum is a stunning view of Spruce Tree House, the third largest and best-preserved cliff dwelling in the park.","From the park entrance, drive 20 miles (32.2 km) to the all-way stop on Chapin Mesa. Turn right and the museum is about 0.7 miles (1.13 km) around the loop on the right. There are a limited number of parking spaces across from the museum for small vehicles. Past the museum is a longer parking area.",https://www.nps.gov/meve/planyourvisit/directions.htm,https://www.nps.gov/meve/planyourvisit/museum.htm,8:30AM - 4:30PM,8:30AM - 4:30PM,8:30AM - 4:30PM,8:30AM - 4:30PM,8:30AM - 4:30PM,8:30AM - 4:30PM,8:30AM - 4:30PM
Mesa Verde,meve,Mesa Verde Visitor and Research Center,37.3359734122,-108.408172024,"Located at the park entrance, off Highway 160, this is the park’s primary facility for orienting visitors to opportunities within the park and surrounding area. Accessible exhibits explore the richness of Ancestral Pueblo culture and daily life. The Mesa Verde Museum Association Park Store offers books, trail guides, maps, and other items that you may find useful during or after your visit, and free Wi-Fi. Restrooms are located near the entrance to the visitor center.","The Mesa Verde Visitor and Research Center is near the park entrance, located just off Highway 160 between the towns of Mancos and Cortez, and about 35 miles west of Durango, Colorado.",http://www.nps.gov/meve/planyourvisit/directions.htm,https://www.nps.gov/meve/planyourvisit/meve_vc.htm,8:30AM - 4:00PM,8:30AM - 4:00PM,8:30AM - 4:00PM,8:30AM - 4:00PM,8:30AM - 4:00PM,8:30AM - 4:00PM,8:30AM - 4:00PM
Mount Rainier,mora,Carbon River Ranger Station,46.987119623,-121.961437689,"Located in the northwest corner of the park, the ranger station is staffed by rangers or volunteers. Building hours may vary so call ahead for hours 360-829-9639. When open, rangers and volunteers provide park information, wilderness camping, and climbing permits. Wilderness camping permits available by self-registration when closed.","Located on the Carbon River Road, 5.5 miles east of its junction with the Mowich Lake Road (State Route 165), the ranger station is just over 2 miles before the road ends at the park boundary.",http://www.nps.gov/mora/planyourvisit/directions.htm,https://www.nps.gov/mora/planyourvisit/carbon-river-and-mowich.htm,7:30AM - 5:00PM,7:30AM - 5:00PM,7:30AM - 5:00PM,7:30AM - 5:00PM,7:30AM - 5:00PM,7:30AM - 5:00PM,7:30AM - 5:00PM
Mount Rainier,mora,Henry M Jackson Memorial Visitor Center,46.7858581359299,-121.736707706863,"Located at Paradise, on the south side of Mount Rainier, the Jackson Visitor Center is open throughout the summer and with limited days and hours in the winter. Inside the visitor center are accessible restrooms, an information desk staffed by a ranger or volunteer, food services, gift shop, park movie, and exhibits about the plants, animals, and the volcano.","There is no physical address for the Henry Jackson Visitor Center. It is located at Paradise, on the south side of the mountain, on the road connecting Longmire and Stevens Canyon. For GPS users, it is at 46.785887,-121.736573 . During the winter (November-April), most park roads are closed except the one from Longmire to Paradise. That road is closed nightly for safety. Check www.twitter.com/MountRainierNPS for daily winter road updates and tire chain restrictions.",http://www.nps.gov/mora/planyourvisit/directions.htm,http://www.nps.gov/mora/planyourvisit/paradise.htm,9:30AM - 5:30PM,9:30AM - 5:30PM,9:30AM - 5:30PM,9:30AM - 5:30PM,9:30AM - 5:30PM,9:30AM - 5:30PM,9:30AM - 5:30PM
Mount Rainier,mora,Longmire Museum,46.7497616262962,-121.812359610396,"Located on the south side of Mount Rainier at 2,700 feet above sea level, the museum makes up part of the historic Longmire district. Once a ranger office, the building now houses historic exhibits about the park's natural and geological history, and animals. A ranger or volunteer staffs the museum to assist with park information and book and map sales.","The Longmire Museum has no physical address. It is in Longmire, on the south side of the mountain, about 9 miles east of the town of Ashford on State Route 706.",http://www.nps.gov/mora/planyourvisit/directions.htm,http://www.nps.gov/mora/planyourvisit/longmire.htm,9:00AM - 4:30PM,9:00AM - 4:30PM,9:00AM - 4:30PM,9:00AM - 4:30PM,9:00AM - 4:30PM,9:00AM - 4:30PM,9:00AM - 4:30PM
Mount Rainier,mora,Longmire Wilderness Information Center,46.75013592564461,-121.81167561090456,"Open during the summer, the Longmire Wilderness Information Center (WIC) is located in the lobby of the historic Longmire Administration Building, a picturesque example of National Park Service rustic architecture in Longmire. The WIC features a 3D model map of Mount Rainier National Park and has an information desk staffed by wilderness rangers. Rangers at the WIC assist with wilderness permits, trip planning, and providing maps and trail condition updates.","The Longmire WIC has no physical address. It is in Longmire, on the south side of the mountain, about 9 miles east of the town of Ashford on State Route 706.",http://www.nps.gov/mora/planyourvisit/directions.htm,https://www.nps.gov/mora/planyourvisit/longmire.htm,7:30AM - 5:00PM,7:30AM - 5:00PM,7:30AM - 5:00PM,7:30AM - 5:00PM,7:30AM - 5:00PM,7:30AM - 5:00PM,7:30AM - 5:00PM
