wiki_name,parkCode,name,lat,lon,description,directionsInfo,directionsUrl,url,monday,tuesday,wednesday,thursday,friday,saturday,sunday
Grand Canyon,grca,North Rim Visitor Center Park Store,36.1983863316,-112.052478703,"The Visitor Center/Park Store will be open for the season between May 15, and October 15, 2024. Visitors have an opportunity to ask questions, plan trips, and learn about the day's activities and programs. The store offers a wide variety of books, maps, souvenirs, and gift items and is open from 9 am to 5 pm daily. Park rangers staff an outdoor information desk between 10 am and 4 pm daily, at the Roaring Springs Overlook Kiosk, just north of the Visitor Center building, and along the canyon rim.","Leaving U.S. 89A at the Jacob Lake junction, travel south on State Route 67 and drive 43 miles through forests and meadows to the North Rim of Grand Canyon. The North Rim Visitor Center is at the end of State Route 67, within the Grand Canyon Lodge complex, on the left, and adjacent to the main parking area for the lodge and Bright Angel Point. The North Rim of the park, as well as State Route 67 closes to all vehicle traffic from December 1, through May 14, due to snow.",https://www.nps.gov/grca/planyourvisit/directions_n_rim.htm,https://www.nps.gov/grca/planyourvisit/north-rim.htm,9:00AM - 5:00PM,9:00AM - 5:00PM,9:00AM - 5:00PM,9:00AM - 5:00PM,9:00AM - 5:00PM,9:00AM - 5:00AM,9:00AM - 5:00PM
Grand Canyon,grca,Verkamp's Visitor Center (South Rim),36.057664089376054,-112.13567272715773,"In the Village Historic District, near Hopi House and El Tovar Hotel, Verkamp's Visitor Center features exhibits that focus on the Grand Canyon Community; what it was like to live and work here on the brink of one of the seven natural wonders. A staffed information desk and a Grand Canyon Conservancy Museum Store are also located here. A water bottle filling station is just outside of the building near the canyon rim, and public restrooms are available in a separate building behind the Visitor Center.","Verkamp's Visitor Center is a short walk just east of El Tovar Hotel and Hopi House. Parking in the nearby lot may be limited during busy periods, which include spring break, summer and fall months. If you are walking from the shuttle bus stop across from the Railroad Depot, climb the stairway to the top of the hill. Here you will find El Tovar Hotel, Hopi House, and Verkamp's Visitor Center. They are located on the east end of the Village Historic District.",,https://www.nps.gov/grca/planyourvisit/verkamps.htm,8:00AM - 7:00PM,8:00AM - 7:00PM,8:00AM - 7:00PM,8:00AM - 7:00PM,8:00AM - 7:00PM,8:00AM - 7:00PM,8:00AM - 7:00PM
Grand Teton,grte,Colter Bay Visitor Center,43.903168150000006,-110.64369568199999,"A surviving Mission 66 visitor center, the Colter Bay Visitor Center provides great views of Jackson Lake. Home of the Indigenous Arts and Cultural Demonstration Program. Inside, meet artists and view exhibits of Indigenous art. Watch the park film in the auditorium throughout the day. Visit this facility for trip planning information, backcountry, or boating permits. Shop at the Grand Teton Association bookstore, attend a ranger-led program, or visit nearby shops and restaurants.","Heading north on US 26/89/191, turn left (north) at Moran Junction and continue 10.5 miles on US 89/191/287 to the Colter Bay Village sign, turn left (west) and continue about one mile to the visitor center. Heading south on US 89/191/287 from Yellowstone National Park, continue 18.5 miles to the Colter Bay Village sign, turn right (west) and continue about one mile to the visitor center",http://www.nps.gov/grte/planyourvisit/directions.htm,https://www.nps.gov/grte/planyourvisit/cbvc.htm,8:00AM - 5:00PM,8:00AM - 5:00PM,8:00AM - 5:00PM,8:00AM - 5:00PM,8:00AM - 5:00PM,8:00AM - 5:00PM,8:00AM - 5:00PM
Grand Teton,grte,Craig Thomas Discovery & Visitor Center,43.6533806502,-110.718606283,"The grand expanse of the Teton Range rises above the visitor center. Inside, interwoven themes of place, people, preservation, mountaineering, and Indigenous tribes encourage visitors to contemplate the past, present, and future of this place. Visit this facility for trip planning information, backcountry or boating permits. Shop at the Grand Teton Association Park Store, enjoy the variety of exhibits and artwork, attend a ranger program or watch a movie about the park.","Located 12 miles north of Jackson, Wyoming just off US Highway 26/89/191. Turn west at Moose Junction onto the Teton Park Road. Continue for 0.5 mile and cross the Snake River. Turn left/south into the parking lot.",http://www.nps.gov/grte/planyourvisit/directions.htm,https://www.nps.gov/grte/planyourvisit/ctdvc.htm,8:00AM - 5:00PM,8:00AM - 5:00PM,8:00AM - 5:00PM,8:00AM - 5:00PM,8:00AM - 5:00PM,8:00AM - 5:00PM,8:00AM - 5:00PM
Grand Teton,grte,Flagg Ranch Information Station,44.106886,-110.666099,"The Flagg Ranch Information Station is located in the John D. Rockefeller, Jr. Memorial Parkway—the heart of the Greater Yellowstone Ecosystem. For visitors traveling south from Yellowstone National Park, Flagg Ranch is the first stop for trip planning information. This small wooden cabin is staffed daily during the peak summer season and includes a visitor information area, exhibits, and restrooms.","Heading south on US 89/191/287, continue two miles south from the South Gate of Yellowstone National Park and turn right (west) at the Headwaters sign. Heading north on US 89/191/287, continue 22 miles north from Jackson Lake Junction and turn left (west) at the Headwaters sign.",http://www.nps.gov/grte/planyourvisit/directions.htm,https://www.nps.gov/grte/planyourvisit/flaggranchplan.htm,Closed,Closed,Closed,Closed,Closed,Closed,Closed
Grand Teton,grte,Jenny Lake Ranger Station,43.752224,-110.722272,"In the 1930s, the Jenny Lake Ranger Station and Museum opened as the park’s first visitor facility. Today, climbing rangers provide safety information, issue backcountry and boat permits, share climbing route conditions, and perform mountain rescues. Climbing and day hiking do not require a backcountry camping permit unless camping overnight in the backcountry. Backcountry permits involving climbing or mountaineering, and camping in Garnet Canyon must be obtained at the Jenny Lake Ranger Station.","Heading north from Jackson on US 26/89/191, turn left (west) at Moose Junction and continue eight miles north to South Jenny Lake Junction. Turn left (west) into the developed area. Heading south from Yellowstone on US 89/191/287, turn right (southwest) at Jackson Lake Junction and continue 12 miles south to South Jenny Lake Junction. Turn right (west) into the developed area.",http://www.nps.gov/grte/planyourvisit/directions.htm,https://www.nps.gov/grte/planyourvisit/jlrangerstation.htm,8:00AM - 5:00PM,8:00AM - 5:00PM,8:00AM - 5:00PM,8:00AM - 5:00PM,8:00AM - 5:00PM,8:00AM - 5:00PM,8:00AM - 5:00PM
Grand Teton,grte,Jenny Lake Visitor Center,43.75152336933463,-110.72237044008159,"Harrison Crandall built this cabin in 1921 near the Cathedral Group Turnout as his studio. Today, the visitor center highlights the relationship between art, inspiration, and action in Grand Teton. Rangers are available at the front desk, in the plaza, and on trails for trip planning, park information, and education. Attend one of the many ranger programs offered here or shop at the Grand Teton Association bookstore. The nearby Jenny Lake Ranger Station offers backcountry and boat permits.","Heading north from Jackson on US 26/89/191, turn left (west) at Moose Junction and continue eight miles north to Jenny Lake Junction. Turn left (west) into the developed area. Heading south from Yellowstone on US 89/191/287, turn right (southwest) at Jackson Lake Junction and continue 12 miles south to Jenny Lake Junction. Turn right (west) into the developed area.",http://www.nps.gov/grte/planyourvisit/directions.htm,https://www.nps.gov/grte/planyourvisit/jlvc.htm,9:00AM - 5:00PM,9:00AM - 5:00PM,9:00AM - 5:00PM,9:00AM - 5:00PM,9:00AM - 5:00PM,9:00AM - 5:00PM,9:00AM - 5:00PM
Grand Teton,grte,Laurance S. Rockefeller Preserve Center,43.6264160495,-110.775228384,"The Laurance S. Rockefeller Preserve Center allows visitors to learn about Mr. Rockefeller's vision and his legacy of conservation stewardship. Exhibits engage visual, tactile, and auditory senses through a poem by Terry Tempest Williams, audio recordings of Mr. Rockefeller, videos, photography, and a soundscape room. Visitors may relax in the resource room, attend a ranger program, or strike out on a hike to Phelps Lake. The center does not have a sales area or offer permits.","The Preserve Center is NOT accessible to vehicles over 23.3 feet long or trailers. Access to the center will be impacted by Moose-Wilson Road Construction in 2022. Heading north from Teton Village on WY 390, continue 3.2 miles from the Granite Entrance Gate and turn right (east) at the Preserve Center sign. Heading south from Moose on the Teton Park Road, turn south at the sign reading ""Wilson Road/Teton Village 9 miles."" Continue 3.7 miles and turn left (east) at the Preserve Center sign.",http://www.nps.gov/grte/planyourvisit/directions.htm,https://www.nps.gov/grte/planyourvisit/lsrpvc.htm,9:00AM - 5:00PM,9:00AM - 5:00PM,9:00AM - 5:00PM,9:00AM - 5:00PM,9:00AM - 5:00PM,9:00AM - 5:00PM,9:00AM - 5:00PM
Grand Teton,grte,National Elk Refuge & Greater Yellowstone Visitor Center,43.4862990495,-110.761734984,"The National Elk Refuge & Greater Yellowstone Visitor Center is an visitor center located in Jackson, WY. The visitor center is owned and operated by the U.S. Fish and Wildlife Service on the National Elk Refuge. The six agencies that operate from the visitor center are the Bridger-Teton National Forest, Grand Teton Association, Grand Teton National Park, National Elk Refuge, Jackson Hole Chamber of Commerce, and Wyoming Game & Fish.","The National Elk Refuge & Greater Yellowstone Visitor Center is an inter-agency visitor center located in Jackson, WY.",,https://www.fws.gov/refuge/national-elk,9:00AM - 5:00PM,9:00AM - 5:00PM,9:00AM - 5:00PM,9:00AM - 5:00PM,9:00AM - 5:00PM,9:00AM - 5:00PM,9:00AM - 5:00PM
Great Basin,grba,Great Basin Visitor Center,39.0152052818,-114.126570101,"Phone: (775) 234-7520 Located just north of the town of Baker on the west side of NV Highway 487. The Visitor Center contains an information desk staffed by park rangers, exhibits about the ecology and history of the park, a theater with the park film, and brochures.","From Baker, NV take 487 .5 miles north. The Great Basin Visitor Center is on the right.",,https://nps.gov/grba/planyourvisit/visitor-centers.htm,8:00AM - 5:00PM,8:00AM - 5:00PM,8:00AM - 5:00PM,8:00AM - 5:00PM,8:00AM - 5:00PM,8:00AM - 5:00PM,8:00AM - 5:00PM
Great Basin,grba,Lehman Caves Visitor Center,39.005691127,-114.219904098,"Phone: (775) 234-7510 Lehman Caves Visitor Center is located 5.5 miles up from the town of Baker, NV. At this visitor center visitors can plan their visit, purchase cave tour tickets, watch the park movie, and explore exhibits about the caves and the darkness of Great Basin National Park.","From Baker, NV take 488 5.5 miles to the end of the road.",,https://nps.gov/grba/planyourvisit/visitor-centers.htm,8:00AM - 5:00PM,8:00AM - 5:00PM,8:00AM - 5:00PM,8:00AM - 5:00PM,8:00AM - 5:00PM,8:00AM - 5:00PM,8:00AM - 5:00PM
Great Sand Dunes,grsa,Entrance Station,37.7251159672,-105.519241643,"Purchase park passes at the Entrance Station, located on the main entrance road. Entrance Station hours are variable depending on the season and day, but are generally open during standard business hours in warmer months.",,,https://www.nps.gov/grsa/planyourvisit/fees.htm,All Day,All Day,All Day,All Day,All Day,All Day,All Day
Great Sand Dunes,grsa,Great Sand Dunes Visitor Center,37.733207337419934,-105.51212883205153,"The visitor center offers restrooms, a water fill station, interactive exhibits, and a 20-minute video about the park. Park rangers are available to answer questions and help you plan your time.","From CO Highway 160: Between the towns of Alamosa, CO, and Blanca, CO, there will be large brown signs marking the turn off to the park. Turn north on CO State Highway 150. Drive straight (north) for 15 miles to the entrance of the park. From CO Highway 17: Near the town of Mosca, CO, turn onto County Road Lane 6N. At the end of the road, turn left (north) onto CO State Highway 150. This highway will take you into the national park.",https://www.nps.gov/grsa/planyourvisit/directions.htm,https://www.nps.gov/grsa/planyourvisit/visitor-center.htm,9:00AM - 4:30PM,9:00AM - 4:30PM,9:00AM - 4:30PM,9:00AM - 4:30PM,9:00AM - 4:30PM,9:00AM - 4:30PM,9:00AM - 4:30PM
Great Smoky Mountains,grsm,Cades Cove Visitor Center,35.5849678472,-83.8430866741,"Roughly half-way through the Cades Cove Loop Road, pause to speak with park staff and visit various exhibits. Learn about Southern Mountain life and culture, and see a gristmill (operates spring through fall), the Becky Cable house, and other historic structures. Enjoy seasonal ranger-led activities and peruse the park bookstore and shop. Public restrooms available.",Located halfway around the Cades Cove Loop Road.,,,9:00AM - 5:00PM,9:00AM - 5:00PM,9:00AM - 5:00PM,9:00AM - 5:00PM,9:00AM - 5:00PM,9:00AM - 5:00PM,9:00AM - 5:00PM
Great Smoky Mountains,grsm,Kuwohi Visitor Center,35.55744395735922,-83.4960401058197,Kuwohi (formerly Clingmans Dome) is the tallest peak in the Smokies. Enjoy sweeping views of the Smokies—weather permitting—and get your park questions answered. Peruse a small bookstore and shop. Public restrooms are available.,"Located at the end of Clingmans Dome Road, seven miles from Newfound Gap Road.",,https://www.nps.gov/grsm/planyourvisit/visitorcenters.htm#CP_JUMP_899351,9:30AM - 6:00PM,9:30AM - 6:00PM,9:30AM - 6:00PM,9:30AM - 6:00PM,9:30AM - 6:00PM,9:30AM - 6:00PM,9:30AM - 6:00PM
Great Smoky Mountains,grsm,Oconaluftee Visitor Center,35.5127186465,-83.3062400727,"Near Cherokee, North Carolina, the Oconaluftee Visitor Center is an ideal starting point as you enter the park's South District. Explore cultural history exhibits. Enjoy ranger-led programs conducted seasonally. Peruse the park bookstore and shop. Find public restrooms and drink vending machines. The adjacent Mountain Farm Museum contains a collection of log structures including a farmhouse, barn, smokehouse, applehouse, corn crib and others.","Located on Newfound Gap Road (US-441) two miles north of Cherokee, NC",,https://www.nps.gov/grsm/planyourvisit/visitorcenters.htm#CP_JUMP_897119,9:00AM - 5:00PM,9:00AM - 5:00PM,9:00AM - 5:00PM,9:00AM - 5:00PM,9:00AM - 5:00PM,9:00AM - 5:00PM,9:00AM - 5:00PM
Great Smoky Mountains,grsm,Sugarlands Visitor Center,35.685629346,-83.536602473,"Near Gatlinburg, TN, Sugarlands Visitor Center is an excellent starting point as you enter the park's North District. Learn about the park's plants and animals with natural history exhibits. Enjoy ranger-led programs conducted seasonally. Peruse the park bookstore and shop. Access public restrooms and drink vending machines. The Backcountry Permit Office is here, too.","Located on Newfound Gap Road (US-441) two miles south of Gatlinburg, TN.",http://www.nps.gov/grsm/planyourvisit/directions.htm,https://www.nps.gov/grsm/planyourvisit/visitorcenters.htm,9:00AM - 5:00PM,9:00AM - 5:00PM,9:00AM - 5:00PM,9:00AM - 5:00PM,9:00AM - 5:00PM,9:00AM - 5:00PM,9:00AM - 5:00PM
Guadalupe Mountains,gumo,Dog Canyon Ranger Station,31.9963104986,-104.833418073,Visitors can pick up brochures and maps from the Dog Canyon Ranger Station when staff or volunteers are available. The Dog Canyon Ranger Station is open intermittently depending on staff availability. If staff and volunteers are present they may be patrolling trails or the campground and not necessarily inside the station.,"Coming from Texas: Traveling north on Highway 62/180 you will cross the state line into New Mexico. About 27 miles after crossing the state line, you will come up on the junction of Dark Canyon Rd-408. Turning in to Dark Canyon Rd-408 N follow the road for 22 miles to the junction of NM-137 N. At the junction, turn into NM-137 N and follow for 35 miles to the entrance of Dog Canyon.",,,Closed,Closed,Closed,Closed,Closed,Closed,Closed
Guadalupe Mountains,gumo,McKittrick Canyon Visitor Center,31.977485,-104.752101,"Visit the contact station at the mouth of McKittrick Canyon (staffed during peak seasons in the spring and fall). Pick up a park brochure, and view the outside exhibits and video.","Guadalupe Mountains National Park is located in far West Texas on U.S. Highway 62/180. The driving distance is 110 miles east of El Paso, Texas, 56 miles southwest of Carlsbad, New Mexico or 62 miles north of Van Horn on Hwy 54. The McKittrick Canyon access road is seven miles north of the Pine Springs visitor center. The McKittrick Canyon visitor center is at the end of the McKittrick Canyon access road.",https://www.nps.gov/gumo/planyourvisit/directions.htm,,Closed,Closed,Closed,Closed,Closed,Closed,Closed
Guadalupe Mountains,gumo,Pine Springs Visitor Center,31.8936224,-104.8220597,"Pine Springs Visitor Center is the park's main visitor center and headquarters. Visitors can pay entrance and camping fees, tour the museum, purchase items from the park store, pick up brochures and maps, and obtain overnight wilderness use permits here.","Following US Hwy 62/180, you will see signs along the highway pointing you to our center. The visitor center is on the north side of the highway.",,,8:00AM - 4:00PM,8:00AM - 4:00PM,8:00AM - 4:00PM,8:00AM - 4:00PM,8:00AM - 4:00PM,8:00AM - 4:00PM,8:00AM - 4:00PM
Haleakalā,hale,Haleakalā Visitor Center,20.7151168142,-156.249859217,"About a 30 minute drive from the Headquarters Visitor Center, the Haleakalā Visitor Center is perched on the edge of the impressive volcanic valley. Inside, park staff can answer questions at the information desk. Visitors can learn about the history of the mountain through various displays. There is also a Hawaiʻi Pacific Parks Association bookstore with souvenirs available for purchase. Restrooms are located nearby in a separate building and are open 24/7. Please check the alerts page for any closures.",Haleakalā Visitor Center is 10 miles (16 km) past the Headquarters Visitor Center on the main park road. The driving time between the two Visitor Centers is approximately 30 minutes.,,https://www.nps.gov/hale/planyourvisit/visitorcenters.htm,Sunrise - 12:00PM,Sunrise - 12:00PM,Sunrise - 12:00PM,Sunrise - 12:00PM,Sunrise - 12:00PM,Sunrise - 12:00PM,Sunrise - 12:00PM
Haleakalā,hale,Headquarters Visitor Center,20.7594764691,-156.246784345,"The Headquarters Visitor Center is 1 mile (1.6 km) past the Summit District entrance gate. Inside, park staff can answer questions at the information desk. A small exhibit hall features displays on the park's natural and cultural history. Restrooms are accessible from the outside and open 24/7. Please check park alerts for information on closures.","When entering the park, the Headquarters Visitor Center is on the right about 1 mile (1.6 km) after passing the Summit District entrance gate.",https://www.nps.gov/hale/planyourvisit/directions.htm,https://www.nps.gov/hale/learn/photosmultimedia/virtual-tours.htm,8:30AM - 4:30PM,8:30AM - 4:30PM,8:30AM - 4:30PM,8:30AM - 4:30PM,8:30AM - 4:30PM,8:30AM - 4:30PM,8:30AM - 4:30PM
Haleakalā,hale,Kīpahulu Visitor Center,20.6616606317,-156.044543068,"Located at the coastal Kīpahulu District. Information desk, exhibits on natural and cultural history, and a Hawaiʻi Pacific Parks Association bookstore inside. Restrooms are open 24 hours per day, 7 days per week, except when the park is closed during severe weather events. Please check park alerts for information on closures.",,,,9:00AM - 5:00PM,9:00AM - 5:00PM,9:00AM - 5:00PM,9:00AM - 5:00PM,9:00AM - 5:00PM,9:00AM - 5:00PM,9:00AM - 5:00PM
Hawaiʻi Volcanoes,havo,Kahuku Visitor Contact Station,19.06398378411887,-155.67799402289856,"Located at the Kahuku Unit of the park in the district of Kaʻū, the Kahuku Visitor Contact Station provides park information, assistance, and books and gifts available through Hawaiʻi Pacific Parks Association.","Kahuku is located in the district of Kaʻū, near mile-marker 70.5 on Highway 11, a one-hour drive from Kīlauea Visitor Center.",,,Closed,Closed,Closed,8:00AM - 4:00PM,8:00AM - 4:00PM,8:00AM - 4:00PM,8:00AM - 4:00PM
Hawaiʻi Volcanoes,havo,Welcome Center,19.43278259961773,-155.27394085469956,"The Welcome Center is a great first stop when entering the park. Rangers and volunteers are on duty daily to provide visitors with the latest information on the current conditions, hiking information, things to do and the daily schedule of ranger-led activities. The Hawai‘i Pacific Parks Association operates a park store in the Welcome Center that sells books, posters and other educational materials. Proceeds benefit park programs.",The Welcome Center is a 1.25 mile drive beyond the park entrance station on the right. The building is located near the U.S. flag pole. Parking is available at the nearby ballfield.,,https://www.nps.gov/havo/planyourvisit/welcome-center.htm,9:00AM - 4:45PM,9:00AM - 4:45PM,9:00AM - 4:45PM,9:00AM - 4:45PM,9:00AM - 4:45PM,9:00AM - 4:45PM,9:00AM - 4:45PM
Hot Springs,hosp,Fordyce Bathhouse Visitor Center and Museum,34.51376970068978,-93.05341229988733,"Beginning March 4, 2025, the Fordyce Bathhouse Visitor Center and Museum is open five days a week, Thursday-Monday. Park rangers are available at the front desk from 9 am - 5 pm to assist with any questions and offer information.","The visitor center is located on Central Avenue, downtown Hot Springs Arkansas. Located off Central Avenue and right across from all of the shops downtown, the Visitor Center is on Bathhouse Row. The Fordyce Bathhouse sits between the Maurice Bathhouse and the Quapaw Bathhouse, right next to the stone pillars which mark our grand entrance.",https://www.nps.gov/hosp/planyourvisit/directions.htm,https://www.nps.gov/hosp/learn/historyculture/fordyce-bathhouse.htm,9:00AM - 5:00PM,Closed,Closed,9:00AM - 5:00PM,9:00AM - 5:00PM,9:00AM - 5:00PM,9:00AM - 5:00PM
Indiana Dunes,indu,Indiana Dunes Visitor Center (Dorothy Buell Memorial Visitor Center),41.633223,-87.054323,"View lobby displays and pick up brochures about Porter County, Indiana, Dunes State Park, and Indiana Dunes National Park. Enjoy educational displays and watch two short orientation videos. Shop in the Eastern National bookstore. The visitor center is open everyday with the exception of Thanksgiving Day, Christmas Day, and New Year's Day.","The Indiana Dunes Visitor Center is located on Indiana State Road 49, between U.S. Highway 20 and Interstate 94 (1215 IN-49, Porter, IN 46304). GPS Coordinates: 41.633349, -87.053762 (Decimal Degrees).",http://www.nps.gov/indu/planyourvisit/directions.htm,http://www.nps.gov/indu/planyourvisit/idnlvc.htm,8:00AM - 6:00PM,8:00AM - 6:00PM,8:00AM - 6:00PM,8:00AM - 6:00PM,8:00AM - 6:00PM,8:00AM - 6:00PM,8:00AM - 6:00PM
Indiana Dunes,indu,Paul H. Douglas Center for Environmental Education,41.6064179999,-87.268310001,"The Paul H. Douglas Center for Environmental Education is your gateway to the stunning Paul H. Douglas Trail through Miller Woods. This facility connects you to the natural environment through educational hands-on exhibits, ranger-guided hikes, lectures, animals, crafts, and a Nature Play Zone. Summer hours are 9:00 am to 5:00 pm Central Time (Friday of Memorial Day weekend through Monday of Labor Day weekend). Winter hours are 9:00 am to 4:00 pm Central Time.","The Paul H. Douglas Center for Environmental Education is located in the western portion of the national park at 100 North Lake Street, about one mile north of U.S. Highway 20 in the Miller neighborhood of Gary (100 North Lake Street, Gary, IN 46304). GPS Coordinates: 41.606286, -87.267483 (Decimal Degrees).",http://www.nps.gov/indu/planyourvisit/deec.htm,http://www.nps.gov/indu/planyourvisit/deec.htm,9:00AM - 5:00PM,9:00AM - 5:00PM,9:00AM - 5:00PM,9:00AM - 5:00PM,9:00AM - 5:00PM,9:00AM - 5:00PM,9:00AM - 5:00PM
Isle Royale,isro,Houghton Visitor Center,47.122935730970674,-88.56367707252502,"The Houghton Visitor Center is located in Houghton, Michigan. It is the mainland headquarters for Isle Royale National Park. Trip planning assistance, Ranger III tickets and information, a park store, and viewing the park film are available.","The Visitor Center is located on the east end of Lakeshore Dr. in downtown Houghton, MI on the Keewenaw Waterway adjacent to the historic Dee Stadium. If traveling north on US41, turn right on Lakeshore Dr. just as you enter downtown Houghton on Shelden Avenue. The turn is adjacent to the Chamber of Commerce. If traveling north on M26, merge with US41 South. As you leave downtown use the left lane to briefly return to Shelden Ave and US41 North. Then take a right turn on Lakeshore Dr.",https://www.google.com/maps?q=Houghton%20Visitor%20Center&rlz=1C1GGRV_enUS752US752&um=1&ie=UTF-8&sa=X&ved=0ahUKEwji6OvmoNneAhWkzVkKHdebC70Q_AUIDigB,https://www.nps.gov/isro/planyourvisit/houghton.htm,8:00AM - 5:00PM,8:00AM - 5:00PM,8:00AM - 5:00PM,8:00AM - 5:00PM,8:00AM - 5:00PM,10:00AM - 5:00PM,Closed
