wiki_name,parkCode,name,lat,lon,description,directionsInfo,directionsUrl,url,monday,tuesday,wednesday,thursday,friday,saturday,sunday
Acadia,acad,Hulls Cove Visitor Center,44.40854189883305,-68.24613669953163,"Located close to Bar Harbor off Route 3, the Hulls Cove Visitor Center is Acadia’s main visitor contact station and transportation hub from May into October. It is a popular, and often crowded, first stop for many visitors. It is adjacent to an entrance for the park's iconic 27-mile Park Loop Road and it serves as a key stop for several routes on the fare-free Island Explorer bus system. From a large parking lot, visitors must climb 52 steps to the main entrance. There is a separate accessible entrance.",Located off ME 3 in Hulls Cove (just north of Bar Harbor) Hulls Cove Visitor Center is at the top of the hill above the large parking lots. An accessible entrance is also available.,http://www.nps.gov/acad/planyourvisit/directions.htm,https://www.nps.gov/acad/planyourvisit/hours.htm,8:30AM - 4:30PM,8:30AM - 4:30PM,8:30AM - 4:30PM,8:30AM - 4:30PM,8:30AM - 4:30PM,8:30AM - 4:30PM,8:30AM - 4:30PM
Acadia,acad,Islesford Historical Museum,44.26159227849917,-68.23981761932373,The Islesford Historical Museum is expected to reopen in 2021 showcasing both the upgrades and a community-curated exhibit helping to tell the stories of the Cranberry Isles.,"Accessible only by boat, Islesford Historical Museum is located to the left of the Town Pier in Islesford.",http://www.nps.gov/acad/planyourvisit/directions.htm,http://www.nps.gov/acad/planyourvisit/hours.htm,10:30AM - 4:00PM,10:30AM - 4:00PM,10:30AM - 4:00PM,10:30AM - 4:00PM,10:30AM - 4:00PM,10:30AM - 4:00PM,10:30AM - 4:00PM
Acadia,acad,Schoodic Institute Welcome Center at Rockefeller Hall,44.3360756984,-68.0591393988,The Schoodic Institute Welcome Center at Rockefeller Hall is located on Schoodic Peninsula off the one-way loop road. Exhibits about the old Navy base and park information can be found here.,"Rockefeller Welcome Center is located in the Schoodic District of Acadia. Follow ME 186 into Winter Harbor, and follow signs for the Schoodic Education and Research Center. Take Schoodic Loop Road to Arey Cove Drive, and take your first right onto Acadia Drive. Take your second left onto Atterbury Circle to park in the small parking lot.",http://www.nps.gov/acad/planyourvisit/directions.htm,http://www.nps.gov/acad/planyourvisit/hours.htm,10:00AM - 4:00PM,10:00AM - 4:00PM,10:00AM - 4:00PM,10:00AM - 4:00PM,10:00AM - 4:00PM,10:00AM - 4:00PM,10:00AM - 4:00PM
Acadia,acad,Schoodic Woods Campground Ranger Station,44.38028392493676,-68.06638510448852,"Information, Camping, Island Explorer buses, and park passes.","Located on the Schoodic Peninsula, this campground is 3 miles (5 km) southeast of Winter Harbor. Access to the campground is from Schoodic Loop Drive off ME 186.",http://www.nps.gov/acad/planyourvisit/camping.htm,https://www.nps.gov/acad/planyourvisit/camping.htm,8:00AM - 3:00PM,8:00AM - 3:00PM,8:00AM - 3:00PM,8:00AM - 3:00PM,8:00AM - 3:00PM,8:00AM - 3:00PM,8:00AM - 3:00PM
Acadia,acad,Sieur de Monts Nature Center,44.36210912130982,-68.20784837007523,"Sieur de Monts Nature Center has visitor services, hiking information, and interactive exhibits. It acts as a trailhead for many hiking trails starting in the Sieur de Monts area. Park rangers are present during the spring, summer, and fall months.",Sieur de Monts Nature Center can be accessed from Park Loop Road as well as ME 3 (Main Street) south of Bar Harbor. Follow park signs.,http://www.nps.gov/acad/planyourvisit/directions.htm,http://www.nps.gov/acad/planyourvisit/hours.htm,9:00AM - 5:00PM,9:00AM - 5:00PM,9:00AM - 5:00PM,9:00AM - 5:00PM,9:00AM - 5:00PM,9:00AM - 5:00PM,9:00AM - 5:00PM
Acadia,acad,Winter Information: Bar Harbor Chamber of Commerce,44.389749,-68.204773,"During winter and spring, information and sales of some passes are available at the Bar Harbor Chamber of Commerce, 2 Cottage Street, at the corner of Cottage and Main streets (GPS coordinates = 44.398633, -68.204933). Hours are 8 am to 4 pm weekdays. There will be early closure at 3 pm the day before Thanksgiving Nov 22 and noon on Dec. 31, and full-day holiday closures on Nov 23, Dec 24, Dec 25, Dec 26, and Jan 1.","2 Cottage Street, at the corner of Cottage and Main streets (GPS coordinates = 44.398633, -68.204933).",,https://www.nps.gov/acad/planyourvisit/winter.htm,8:00AM - 4:00PM,8:00AM - 4:00PM,8:00AM - 4:00PM,8:00AM - 4:00PM,8:00AM - 4:00PM,8:00AM - 4:00PM,8:00AM - 4:00PM
American Samoa,npsa,Visitor Center and Park Store,-14.2744135115,-170.696946766,"Open on weekdays from 8:00 am to 3:00 pm. Closed on weekends and federal holidays. Located in Pago Pago village, across from the Pago Way Service Station.",,,,,,,,,,
Arches,arch,Arches Visitor Center,38.61656773313003,-109.62004230217951,The visitor center is generally open every day except December 25. Hours vary by season. You can learn about the park from exhibits and a bookstore. Rangers are on duty to answer your questions. Restrooms and drinking water are available.,"The Arches Visitor Center is located just inside the entrance gate to Arches National Park. From Moab, Utah, drive 5 miles north on US 191. From I-70 (Crescent Junction), drive 28 miles south on US 191. Follow signs to Arches National Park.",http://www.nps.gov/arch/planyourvisit/directions.htm,https://www.nps.gov/arch/planyourvisit/visitorcenters.htm,8:00AM - 5:00PM,8:00AM - 5:00PM,8:00AM - 5:00PM,8:00AM - 5:00PM,8:00AM - 5:00PM,8:00AM - 5:00PM,8:00AM - 5:00PM
Badlands,badl,Ben Reifel Visitor Center,43.74908,-101.94166100000001,"Located at park headquarters, the Ben Reifel Visitor Center features exhibits, an air conditioned theater,and restroom facilities.",The visitor center is located several miles south of exit 131 off of Interstate I-90. It is also accessible via Highway 44 through the town of Interior.,,https://www.nps.gov/thingstodo/visit-ben-reifel.htm,8:00AM - 5:00PM,8:00AM - 5:00PM,8:00AM - 5:00PM,8:00AM - 5:00PM,8:00AM - 5:00PM,8:00AM - 5:00PM,8:00AM - 5:00PM
Badlands,badl,White River Visitor Center,43.511612,-102.49656099999999,"The visitor center is located on the Pine Ridge Reservation and offers a staffed information desk, exhibits, restrooms, picnic tables, and water. Impromptu talks are available by request. This visitor center is only open during the summer season.","The visitor center is located on Pine Ridge Indian Reservation. It lies at the intersection of BIA 2 and BIA 27. It is approximately 30 miles south of Scenic, SD, and 60 miles east of Hermosa via Highway 40.",,https://www.nps.gov/thingstodo/white-river-vc.htm,9:00AM - 4:00PM,9:00AM - 4:00PM,9:00AM - 4:00PM,9:00AM - 4:00PM,9:00AM - 4:00PM,9:00AM - 4:00PM,9:00AM - 4:00PM
Big Bend,bibe,Castolon Visitor Center,29.134282140186286,-103.51492166519165,"Located in the Castolon Historic District, the Castolon Visitor Center is open daily during the winter months. River use permits are issued during normal business hours, and entrance fees can be paid at the Castolon Visitor Center. The Castolon Visitor Center has a Big Bend Natural History Association bookstore and nearby restrooms. The visitor center is located in the historic Garlick House, immediately behind the Magdalena House Exhibits. Stop by to meet a ranger and plan your adventure.","The Castolon Visitor Center is located within the Castolon Historic District of Big Bend National Park. The site is located along the Ross Maxwell Scenic Drive, approximately 8 miles from the Santa Elena Canyon trailhead. The visitor center is inside the historic officer's quarters building.",,https://www.nps.gov/bibe/planyourvisit/big-bend-visitor-centers.htm,10:00AM - 4:00PM,10:00AM - 4:00PM,10:00AM - 4:00PM,10:00AM - 4:00PM,10:00AM - 4:00PM,10:00AM - 4:00PM,10:00AM - 4:00PM
Big Bend,bibe,Chisos Basin Visitor Center,29.2705194325,-103.29934792,"The Chisos Basin Visitor Center includes interactive exhibits on plants, animals, and birds found in the Chisos Mountains. Backcountry and river use permits are issued during normal business hours, and entrance fees can be paid at the visitor center. A Big Bend Natural History Association bookstore and restrooms are located at the visitor center. A water faucet is available on the east side of the building for filling personal water containers","The Chisos Basin Visitor Center is located in the Basin developed area, 10 miles southwest of Panther Junction.",,https://www.nps.gov/bibe/planyourvisit/big-bend-visitor-centers.htm,8:30AM - 4:00PM,8:30AM - 4:00PM,8:30AM - 4:00PM,8:30AM - 4:00PM,8:30AM - 4:00PM,8:30AM - 4:00PM,8:30AM - 4:00PM
Big Bend,bibe,Panther Junction Visitor Center,29.3278272156,-103.20588915,"Panther Junction Visitor Center is the best place to begin your visit. Backcountry & river use permits are issued here. Entrance fees can be paid here. Exhibits provide an overview of geology & natural and cultural histories of the park. The visitor center also has a theater with a park orientation movie shown upon request.The visitor center complex includes a Big Bend Natural History Association bookstore, U.S. Post Office, and restrooms. A water faucet is available for filling personal water containers","Panther Junction Visitor Center is located in the center of the park. It is 68 miles south of the town of Marathon, and 29 miles east of the town of Study Butte.",,https://www.nps.gov/bibe/planyourvisit/big-bend-visitor-centers.htm,8:30AM - 5:00PM,8:30AM - 5:00PM,8:30AM - 5:00PM,8:30AM - 5:00PM,8:30AM - 5:00PM,8:30AM - 5:00PM,8:30AM - 5:00PM
Big Bend,bibe,Persimmon Gap Visitor Center,29.6600396357,-103.173613458,"Located at the north entrance to the park, Persimmon Gap Visitor Center offers park orientation and information. The visitor center has exhibits, bookstore, mini-theater, and restrooms. River permits for the Lower Canyons are issued during normal business hours, and entrance fees can be paid at the Persimmon Gap Visitor Center.","The Persimmon Gap Visitor Center is located on Hwy 385, 42 miles south of the town of Marathon, Texas, and 26 miles north of Panther Junction.",,https://www.nps.gov/bibe/planyourvisit/big-bend-visitor-centers.htm,10:00AM - 4:00PM,10:00AM - 4:00PM,10:00AM - 4:00PM,10:00AM - 4:00PM,10:00AM - 4:00PM,10:00AM - 4:00PM,10:00AM - 4:00PM
Big Bend,bibe,Rio Grande Village Visitor Center,29.185260594,-102.962224896,"The Rio Grande Village Visitor Center is located 0.25 miles north of the Rio Grande Village developed area. New exhibits focus on the Rio Grande (how it has changed over time, how the NPS works with our Mexican counterparts to protect and care for it, and the rich assemblage of species that it supports). An outdoor ramada showcases a large raised-relief map of the area, and life-sized bronze sculptures showcase some of the area's special wildlife. River use permits are issued during normal business hours.","Rio Grande Village Visitor Center is located 0.25 miles north of the Rio Grande Village developed area, and 20 miles east of Panther Junction.",https://www.nps.gov/bibe/planyourvisit/directions.htm,https://www.nps.gov/bibe/planyourvisit/big-bend-visitor-centers.htm,9:00AM - 4:30PM,9:00AM - 4:30PM,9:00AM - 4:30PM,9:00AM - 4:30PM,9:00AM - 4:30PM,9:00AM - 4:30PM,9:00AM - 4:30PM
Biscayne,bisc,Dante Fascell Visitor Center,25.464444,-80.334822,"The Dante Fascell Visitor Center is located at Convoy Point, 9 miles East of the city of Homestead, Florida. A beautiful museum offers a virtual journey through the park's four ecosystems using dioramas, audio and video. Several films are available to help you learn about the park, including the 20-minute feature presentation: Connections. The Gallery highlights the works of local artists who find inspiration in the park.",From the Florida Turnpike take Exit 6 (Speedway Boulevard). Turn left from exit ramp and continue south to SW 328th Street (North Canal Drive). Turn left on 328th Street and continue for four miles to the end of the road. The park entrance is on the left just before the entrance to Homestead Bayfront Marina.,http://www.nps.gov/bisc/planyourvisit/directions.htm,http://www.nps.gov/bisc/planyourvisit/convoypoint.htm,9:00AM - 5:00PM,9:00AM - 5:00PM,9:00AM - 5:00PM,9:00AM - 5:00PM,9:00AM - 5:00PM,9:00AM - 5:00PM,9:00AM - 5:00PM
Black Canyon of the Gunnison,blca,North Rim Ranger Station,38.58703032928486,-107.70483706805055,"The ranger station is staffed periodically by climbing rangers in the summer and closed in the winter. In the summer, maps and information are available on the ranger station porch. A self-pay station for the park entrance fee and a self-registration kiosk for wilderness permits are located outside.","The North Rim is 11 miles southwest of Crawford, Colorado. From CO Highway 92, turn west on Black Canyon Road approximately 3 miles south of Crawford. Follow the road signs to the park. The last 7 miles are unpaved. The North Rim is closed to vehicles in the winter.",https://www.nps.gov/blca/planyourvisit/directions.htm,https://www.nps.gov/blca/planyourvisit/northrim.htm,All Day,All Day,All Day,All Day,All Day,All Day,All Day
Black Canyon of the Gunnison,blca,South Rim Visitor Center,38.5549915021,-107.686583816,"This visitor center has exhibits, information, book and map sales, water (available seasonally), vault toilets, and hiking trailheads. It is open year-round with the exception of Thanksgiving Day, Christmas Day, and New Years Day.",7 miles north on CO Highway 347 from the intersection with U.S. Highway 50. GPS: N 38.5550 W -107.6866,https://www.nps.gov/blca/planyourvisit/directions.htm,http://www.nps.gov/blca,9:00AM - 4:00PM,9:00AM - 4:00PM,9:00AM - 4:00PM,9:00AM - 4:00PM,9:00AM - 4:00PM,9:00AM - 4:00PM,9:00AM - 4:00PM
Bryce Canyon,brca,Bryce Canyon Visitor Center,37.6403873677938,-112.169642330719,"The Bryce Canyon Visitor Center might be one of your first stops when visiting Bryce Canyon National Park. Here you can obtain driving and hiking directions beyond those available on this website, weather forecasts, a current schedule of Park Ranger guided programs, Junior Ranger booklets, and information on area services including lodging, dining and other attractions.",The Visitor Center is located approximately one mile south from the park entrance on UT-63. From the North: Take I-15 south to UT-20 (exit 95). Travel east on UT-20 to US-89. Follow US-89 south to UT-12. Travel east on UT-12 to UT-63. Take UT-63 south to Bryce Canyon National Park. From the South through Zion National Park: Take I-15 north to UT-9 (exit 16). Follow UT-9 east through Zion National Park to US-89. Travel north on US-89 to UT-12. Go east on UT-12 to UT-63. Take UT-63 south to the park.,http://www.nps.gov/brca/planyourvisit/directions.htm,https://shop.brycecanyon.org/,8:00AM - 8:00PM,8:00AM - 8:00PM,8:00AM - 8:00PM,8:00AM - 8:00PM,8:00AM - 8:00PM,8:00AM - 8:00PM,8:00AM - 8:00PM
Canyonlands,cany,Canyonlands Backcountry Office,38.539153,-109.51026,The central backcountry office is located at park administrative offices south of Moab. Rangers can answer questions about backcountry travel over phone or email and issue permits online.,Canyonlands administrative offices are about five miles south of Moab on US 191.,,https://www.nps.gov/cany/planyourvisit/hours.htm,8:00AM - 4:00PM,8:00AM - 4:00PM,8:00AM - 4:00PM,8:00AM - 4:00PM,8:00AM - 4:00PM,Closed,Closed
Canyonlands,cany,Hans Flat Ranger Station,38.2560062,-110.1783739,"The remote Hans Flat (Maze) Ranger Station is normally open daily year-round. This ranger contact station has a picnic table and vault toilet, and a small selection of books and maps for sale. There are no services, food, gas, trash collection, electricity for visitor use, nor potable water in The Maze. The nearest communities with amenities are Hanksville (68 miles) and Green River (86 miles).","Getting to the Maze requires four-wheel-drive and a lot of time. To reach Hans Flat Ranger Station, from I-70 take UT 24 south for 24 miles. A left turn just beyond the turnoff to Goblin Valley State Park will take you along an unpaved, two-wheel-drive dirt road, 46 miles to the ranger station. Blowing sand dunes or precipitation can degrade the road condition at any time. Roads beyond the ranger station require high clearance and four-wheel drive year-round.",http://www.nps.gov/cany/planyourvisit/directions.htm,,8:00AM - 3:00PM,8:00AM - 3:00PM,8:00AM - 3:00PM,8:00AM - 3:00PM,8:00AM - 3:00PM,8:00AM - 3:00PM,8:00AM - 3:00PM
Canyonlands,cany,Island in the Sky Visitor Center,38.459905868,-109.82099489699999,"The Island in the Sky Visitor Center offers exhibits, book & map sales, park orientation film, backcountry permits, general information, vault toilets, and park rangers on duty. You can get drinking water inside (during open hours) or outside (24 hours a day) during summer and fall. Water is only available inside (during open hours) in winter.","On US 191, drive 10 miles north of Moab or 22 miles south of Interstate 70 (Crescent Junction), then take UT 313 southwest for 22 miles. Follow signs for Canyonlands National Park. Drive time from Moab is roughly 40 minutes to the visitor center.",http://www.nps.gov/cany/planyourvisit/directions.htm,,8:00AM - 5:00PM,8:00AM - 5:00PM,8:00AM - 5:00PM,8:00AM - 5:00PM,8:00AM - 5:00PM,8:00AM - 5:00PM,8:00AM - 5:00PM
Canyonlands,cany,The Needles Visitor Center,38.168096753,-109.75941037899997,"The Needles Visitor Center normally offers exhibits, book & map sales, backcountry permits, information, picnic area, and park rangers on duty. The park orientation movie (15 minutes) is available on demand. Water is available year-round. When the visitor center is closed in winter, you must self-register for backcountry permits outside the visitor center entrance.","On US 191, drive 40 miles south of Moab, Utah, or 14 miles north of Monticello, Utah, then take UT 211 roughly 35 miles west. Highway 211 ends in The Needles, and is the only paved road leading in and out of the area.",http://www.nps.gov/cany/planyourvisit/directions.htm,,8:00AM - 5:00PM,8:00AM - 5:00PM,8:00AM - 5:00PM,8:00AM - 5:00PM,8:00AM - 5:00PM,8:00AM - 5:00PM,8:00AM - 5:00PM
Capitol Reef,care,Capitol Reef National Park Visitor Center,38.2914727987,-111.262039748,Capitol Reef National Park visitor center sits at the intersection of UT-24 and the Scenic Drive.,"From I-70: take exit 149 then travel UT-24 west toward Hanksville and continue for 43.8 miles (70.5 km). Continue right on UT-24 west for 37.3 miles (60 km). From I-15: Take exit 188, then US-50 east toward Scipio; turn left onto UT-50 and continue for 0.7 miles (1.1 km). Turn right onto US-50 east/ North State Street and continue for 24.4 miles (39.3 km). Turn right onto UT-260 south and continue for 4.2 mile. Turn right onto UT-24 east for 74 miles. UT-12: North to UT-24. Right at Torrey.",http://www.nps.gov/care/planyourvisit/directions.htm,http://www.nps.gov/care,8:00AM - 4:30PM,8:00AM - 4:30PM,8:00AM - 4:30PM,8:00AM - 4:30PM,8:00AM - 4:30PM,8:00AM - 4:30PM,8:00AM - 4:30PM
Carlsbad Caverns,cave,Visitor Center,32.1754814177,-104.444223173,">> RESERVATIONS REQUIRED to enter cavern and must be purchased at recreation.gov or by calling 877-444-6777. The reservation is only for selecting the entry time. Entrance tickets will need to be purchased at the visitor center. << The visitor center offers many services, including a bookstore, gift shop, cafeteria, restrooms, a park movie, information desk, ticket counter, and hands-on educational exhibits.","To access Carlsbad Caverns National Park's only entrance road, New Mexico Highway 7, turn north from U.S. Hwy 62/180 at White's City, New Mexico—which is 20 miles (32 km) southwest of Carlsbad, New Mexico and 145 miles (233 km) northeast of El Paso, Texas. The entrance road stretches a scenic seven miles (11 km) from the park gate at White's City to the visitor center and cavern entrance. The park's visitor center is located 25 miles (40 km) from the town of Carlsbad.",,https://www.nps.gov/cave/planyourvisit/visitor-center.htm,9:00AM - 5:00PM,9:00AM - 5:00PM,9:00AM - 5:00PM,9:00AM - 5:00PM,9:00AM - 5:00PM,9:00AM - 5:00PM,9:00AM - 5:00PM
Channel Islands,chis,Channel Islands National Park Visitor Center,34.2484535,-119.266582,"The Robert J. Lagomarsino Visitor Center at Channel Islands National Park features a bookstore, a display of marine aquatic life, and exhibits featuring the unique character of each park island. Visitors also will enjoy the 25-minute park movie, “A Treasure in the Sea,” shown throughout the day in the auditorium (closed-caption film available upon request). The fully accessible visitor center is open 8:30 am until 5 pm daily. The visitor center is closed on Thanksgiving and December 25th.","The visitor center is located in the Ventura Harbor in Ventura, California. Ventura is located 70 miles north of Los Angeles and 30 miles south of Santa Barbara. Plane, train, and bus service are all available to Los Angeles and Santa Barbara. Only train, bus, and private car transportation are available from Los Angeles and Santa Barbara to Ventura.",http://www.nps.gov/chis/planyourvisit/directions.htm,http://www.nps.gov/chis/planyourvisit/visitorcenters.htm,8:30AM - 5:00PM,8:30AM - 5:00PM,8:30AM - 5:00PM,8:30AM - 5:00PM,8:30AM - 5:00PM,8:30AM - 5:00PM,8:30AM - 5:00PM
Channel Islands,chis,Outdoors Santa Barbara Visitor Center,34.4040948103,-119.693621455,"The small Outdoors Santa Barbara Visitor Center not only has one of the best views of Santa Barbara, but also offers visitors information about Channel Islands National Park, Channel Islands National Marine Sanctuary, Santa Barbara Maritime Museum, and the City of Santa Barbara. Open 10:30 am until 4:30 pm daily. The visitor center is closed on Thanksgiving Day, December 25, January 1, and the first Friday in August for Fiesta.","The Outdoors Santa Barbara Visitor Center is located in the Santa Barbara Harbor in Santa Barbara, California. Santa Barbara is located 100 miles north of Los Angeles and 30 miles north of Ventura. Plane, train, and bus service are all available to Los Angeles and Santa Barbara.",http://www.nps.gov/chis/planyourvisit/directions.htm,http://outdoorsb.sbmm.org/,10:30AM - 4:30PM,10:30AM - 4:30PM,10:30AM - 4:30PM,10:30AM - 4:30PM,10:30AM - 4:30PM,10:30AM - 4:30PM,10:30AM - 4:30PM
Channel Islands,chis,San Miguel Island Ranger and Visitor Contact Station,34.0385019677,-120.351545479,The visitor contact and ranger station is only open when staff is present.,This visitor center can only be visited by boat. Book your transportation with the park concessioner.,https://www.nps.gov/chis/planyourvisit/island-transportation.htm,https://www.nps.gov/places/000/ranger-station.htm,8:30AM - 5:00PM,8:30AM - 5:00PM,8:30AM - 5:00PM,8:30AM - 5:00PM,8:30AM - 5:00PM,8:30AM - 5:00PM,8:30AM - 5:00PM
Channel Islands,chis,Santa Barbara Island Visitor Center,33.4806962333,-119.029582707,A small visitor center is located on the island. Features include displays on the natural and cultural resources of the island.,This visitor center can only be visited by boat. Book your transportation with the park concessioner.,https://www.nps.gov/chis/planyourvisit/island-transportation.htm,,8:30AM - 5:00PM,8:30AM - 5:00PM,8:30AM - 5:00PM,8:30AM - 5:00PM,8:30AM - 5:00PM,8:30AM - 5:00PM,8:30AM - 5:00PM
Channel Islands,chis,Santa Rosa Island Visitor Contact Station,34.007494,-120.050574,The historic schoolhouse is now home to this small visitor contact station with exhibits on the ranching history of Santa Rosa Island.,This visitor center can only be visited by boat. Book your transportation with the park concessioner.,https://www.nps.gov/chis/planyourvisit/island-transportation.htm,https://www.nps.gov/places/000/schoolhouse-1.htm,8:30AM - 5:00PM,8:30AM - 5:00PM,8:30AM - 5:00PM,8:30AM - 5:00PM,8:30AM - 5:00PM,8:30AM - 5:00PM,8:30AM - 5:00PM
Channel Islands,chis,Scorpion Ranch Visitor Center on Santa Cruz Island,34.04887527,-119.558456498,The small visitor center resides in the historic Scorpion Ranch house which was constructed in 1886-1887.,This visitor center can only be visited by boat. Book your transportation with the park concessioner.,https://www.nps.gov/chis/planyourvisit/island-transportation.htm,,8:30AM - 5:00PM,8:30AM - 5:00PM,8:30AM - 5:00PM,8:30AM - 5:00PM,8:30AM - 5:00PM,8:30AM - 5:00PM,8:30AM - 5:00PM
Channel Islands,chis,Visitor Center Anacapa Island,34.015499,-119.36376,"Once the historic Coast Guard general services building (workshop and garage), this Mission Revival style building now serves as a small visitor center that features include displays on the natural and cultural resources of the island and the original lead-crystal Fresnel lens from the Anacapa Lighthouse.",This visitor center can only be visited by boat. Book your transportation with the park concessioner.,https://www.nps.gov/chis/planyourvisit/island-transportation.htm,https://www.nps.gov/chis/planyourvisit/visitorcenters.htm,8:30AM - 5:00PM,8:30AM - 5:00PM,8:30AM - 5:00PM,8:30AM - 5:00PM,8:30AM - 5:00PM,8:30AM - 5:00PM,8:30AM - 5:00PM
Congaree,cong,Harry Hampton Visitor Center,33.82961924617921,-80.8233726725208,"Open 9:00 a.m. to 5:00 p.m. daily. Closed New Year's Day, Washington's Birthday, Columbus Day, Thanksgiving Day, and Christmas Day.","From Interstate 77, take Exit 5 and turn onto SC Hwy 48 East (Bluff Road). Drive approximately 8 miles and then take a slight right onto Old Bluff Road. Follow Old Bluff Road for 4.5 miles to the park entrance sign, which will be on the right. Proceed one mile to the Harry Hampton Visitor Center. Parking lots will be on the right. Short brick paths lead up to the Visitor Center. Inside you find an America's National Parks bookstore.",,https://www.nps.gov/cong/planyourvisit/hours.htm,9:00AM - 5:00PM,9:00AM - 5:00PM,9:00AM - 5:00PM,9:00AM - 5:00PM,9:00AM - 5:00PM,9:00AM - 5:00PM,9:00AM - 5:00PM
